<?xml version="1.0" encoding="UTF-8"?>
<!--
To change this license header, choose License Headers in Project Properties.
To change this template file, choose Tools | Templates
and open the template in the editor.
-->
<libraries xmlns:check="http://www.w3.org/2001/XMLSchema-instance"
           check:noNamespaceSchemaLocation="XmlSchema.xsd">
    <library name="library1"  >
        <location>
             <![CDATA[
                ]]>
        </location>
        <description>
            <![CDATA[
                ]]>
        </description>
        <librarian>
        </librarian>
        <book title="xyz"   >
            <author>
            </author>
            <isbn>2</isbn>
            <preface>
                <![CDATA[
                ]]>
            </preface>
            <part title="part1" >
                <chapter title="chapter1" >
                    <summary>
                    <![CDATA[
                        ]]>
                    </summary>
                    <sections>
                        <paragragh>
                            <![CDATA[
                                ]]>
                        </paragragh>
                    </sections>
                </chapter>
            </part>
        </book>
    </library>
</libraries>
